"film_id","title","actor_names"
14,"Alice Fantasia","Woody Hoffman, Minnie Zellweger, Morgan Williams, Rock Dukakis"
33,"Apollo Teen","Mae Hoffman, Woody Jolie, Ed Mansfield, Albert Johansson, Oprah Kilmer, Mena Hopper, Jeff Silverstone, Debbie Akroyd"
36,"Argonauts Town","Julia Barrymore, Gary Penn, Gene Willis, Dan Streep, Kevin Garland"
38,"Ark Ridgemont","Parker Goldberg, Nick Degeneres, Audrey Bailey"
41,"Arsenic Independence","Cuba Allen, Rita Reynolds, Oprah Kilmer"
87,"Boondock Ballroom","Ed Chase, Jennifer Davis, Uma Wood, Fred Costner, Kirsten Paltrow, Sandra Peck, Dan Harris, Ray Johansson, Kenneth Pesci, Chris Bridges, Warren Jackman, Humphrey Garland, Audrey Bailey"
108,"Butch Panther","Cuba Olivier, Carmen Hunt, Groucho Dunst"
128,"Catch Amistad","Johnny Cage, Christian Akroyd, Kenneth Pesci, Dan Streep, Ian Tandy"
144,"Chinatown Gladiator","Uma Wood, Dan Torn, Bob Fawcett, Jude Cruise, Jessica Bailey, Sean Williams, Penelope Monroe, Geoffrey Heston, Jeff Silverstone, Jayne Silverstone"
148,"Chocolate Duck","Joe Swank, Cameron Streep, Gary Penn, Minnie Zellweger, Julianne Dench, Humphrey Willis, Groucho Williams"
171,"Commandments Express","Johnny Lollobrigida, Burt Dukakis, Warren Jackman, Cuba Birch"
192,"Crossing Divorce","Jude Cruise, Milla Keitel"
195,"Crowds Telemark","Matthew Johansson, Anne Cronyn, Jeff Silverstone, Matthew Carrey"
198,"Crystal Breaking","Reese Kilmer, Jayne Neeson, Penelope Cronyn, Liza Bergman, Fay Wood"
217,"Dazed Punk","Grace Mostel, Bob Fawcett, Ben Willis, Geoffrey Heston, Ben Harris, Greta Malden"
221,"Deliverance Mulholland","Fred Costner, Matthew Leigh, Humphrey Garland"
318,"Firehouse Vietnam","Sandra Peck, Matthew Leigh, Fay Winslet, Ben Harris, Olympia Pfeiffer"
325,"Floats Garden","Rip Winslet, Sean Williams, Ellen Presley, Jim Mostel, Cameron Zellweger"
332,"Frankenstein Stranger","Scarlett Damon, Ben Harris"
359,"Gladiator Westward","Julia Mcqueen, Kirk Jovovich, Adam Grant, Cameron Zellweger, Ian Tandy, Jayne Silverstone"
386,"Gump Date","Dan Torn, Mena Temple, Rip Winslet, Gene Hopkins, River Dean, Jayne Nolte"
404,"Hate Handicap","Bob Fawcett, Kevin Bloom, River Dean"
419,"Hocus Frida","Sandra Kilmer, Frances Tomei, Thora Temple"
495,"Kentuckian Giant","Vivien Bergen, Elvis Marx, Warren Nolte, Russell Close"
497,"Kill Brotherhood","Kirsten Paltrow, Rip Winslet, Woody Jolie, Albert Nolte, River Dean"
607,"Muppet Mile","Rip Winslet, Mae Hoffman, Chris Bridges, Penelope Cronyn, Harrison Bale, Cate Harris, Ben Harris, Al Garland"
642,"Order Betrayed","Angelina Astaire, Spencer Depp, Morgan Hopkins, Penelope Monroe, Greta Malden, Kenneth Hoffman, Humphrey Garland"
669,"Pearl Destiny","Tim Hackman, Cameron Zellweger, Daryl Crawford, Harvey Hope"
671,"Perdition Fargo","Joe Swank, Rip Winslet, Harrison Bale, Cate Mcqueen, Renee Ball"
701,"Psycho Shrunk","Olympia Pfeiffer"
712,"Raiders Antitrust","Jennifer Davis, Milla Peck, Kirsten Akroyd, Kenneth Torn, Walter Torn, Jada Ryder"
713,"Rainbow Shock","Tom Miranda, Dustin Tautou, Kenneth Torn, Jane Jackman, Kim Allen, Greta Malden"
742,"Roof Champion","Nick Wahlberg, Elvis Marx, Dan Streep, Scarlett Bening, Whoopi Hurt"
801,"Sister Freddy","Susan Davis, Humphrey Willis, Gregory Gooding"
802,"Sky Miracle","Elvis Marx, Sissy Sobieski, Woody Jolie, Kirsten Akroyd, Walter Torn, Warren Jackman, Meryl Gibson, Greta Malden, Laura Brody, Laurence Bullock, Jon Chase, Audrey Bailey"
860,"Suicides Silence","Ray Johansson, Julianne Dench, Frances Tomei"
874,"Tadpole Park","Helen Voight, Adam Grant, Ellen Presley, Gene Willis, Greta Malden, Jeff Silverstone, Matthew Carrey, Audrey Bailey"
909,"Treasure Command","Jennifer Davis, Mary Tandy, Ellen Presley, Spencer Depp, Cate Harris, Albert Johansson, Oprah Kilmer"
943,"Villain Desperate","Dustin Tautou, Cary Mcconaughey"
950,"Volume House","Audrey Olivier, Gary Penn, Kenneth Torn, Chris Depp, Reese West"
954,"Wake Jaws","Woody Jolie, Sidney Crowe, Meryl Gibson, Chris Depp, Kenneth Hoffman"
955,"Walls Artist","Chris Bridges, Sylvester Dern, Harrison Bale, Albert Johansson, Jeff Silverstone"
